description,category
water mosquitoes Stagnant breeding,drainage
mosquitoes water breeding Stagnant,drainage
mosquitoes water breeding Stagnant,drainage
Stagnant breeding water mosquitoes,drainage
breeding mosquitoes Stagnant water,drainage
water mosquitoes Stagnant breeding,drainage
Stagnant breeding water mosquitoes,drainage
Stagnant water mosquitoes breeding,drainage
Drainage system is clogged,drainage
system is Drainage clogged,drainage
is clogged system Drainage,drainage
clogged system Drainage is,drainage
system is Drainage clogged,drainage
clogged system is Drainage,drainage
is Drainage clogged system,drainage
system Drainage clogged is,drainage
system is clogged Drainage,drainage
is system clogged Drainage,drainage
clogged system Drainage is,drainage
Drainage system is clogged,drainage
system clogged Drainage is,drainage
system clogged Drainage is,drainage
Drainage system clogged is,drainage
system is Drainage clogged,drainage
system is clogged Drainage,drainage
system is clogged Drainage,drainage
Drainage clogged is system,drainage
is clogged system Drainage,drainage
is Drainage system clogged,drainage
Sewage overflow during rainy season,drainage
Sewage season during overflow rainy,drainage
Sewage overflow season during rainy,drainage
season rainy during Sewage overflow,drainage
season rainy Sewage overflow during,drainage
overflow Sewage rainy during season,drainage
season during rainy Sewage overflow,drainage
Sewage during rainy overflow season,drainage
rainy season during overflow Sewage,drainage
during Sewage overflow season rainy,drainage
overflow rainy season during Sewage,drainage
season overflow Sewage during rainy,drainage
season during rainy overflow Sewage,drainage
overflow Sewage season during rainy,drainage
during season overflow rainy Sewage,drainage
rainy during overflow Sewage season,drainage
rainy Sewage season during overflow,drainage
Open drain is dangerous,drainage
is dangerous Open drain,drainage
drain is Open dangerous,drainage
dangerous Open is drain,drainage
Open is dangerous drain,drainage
Open is dangerous drain,drainage
drain Open is dangerous,drainage
is dangerous Open drain,drainage
dangerous drain is Open,drainage
Open drain is dangerous,drainage
is dangerous drain Open,drainage
drain Open dangerous is,drainage
drain dangerous is Open,drainage
Open dangerous is drain,drainage
is drain Open dangerous,drainage
drain is Open dangerous,drainage
Street light not working,streetlights
working not Street light,streetlights
Street not working light,streetlights
not Street light working,streetlights
not working light Street,streetlights
light working Street not,streetlights
Street working not light,streetlights
not working light Street,streetlights
light Street not working,streetlights
light Street working not,streetlights
working not Street light,streetlights
not light working Street,streetlights
light working Street not,streetlights
light not Street working,streetlights
not light Street working,streetlights
light Street working not,streetlights
Street working light not,streetlights
light Street not working,streetlights
Dark area due to no lights,streetlights
due to Dark no area lights,streetlights
lights no area Dark due to,streetlights
no to lights area due Dark,streetlights
due Dark to no area lights,streetlights
lights to area Dark due no,streetlights
due to lights area no Dark,streetlights
Dark area due to no lights,streetlights
to lights area due no Dark,streetlights
area lights to Dark no due,streetlights
due to Dark area no lights,streetlights
to no Dark due lights area,streetlights
Dark no lights due to area,streetlights
to no due area lights Dark,streetlights
area lights to no Dark due,streetlights
due Dark area lights no to,streetlights
due no to Dark area lights,streetlights
no area lights due Dark to,streetlights
area due lights no to Dark,streetlights
no lights Dark to due area,streetlights
Light pole damaged in storm,streetlights
pole in damaged Light storm,streetlights
storm damaged pole in Light,streetlights
damaged Light pole in storm,streetlights
pole Light damaged storm in,streetlights
in damaged pole Light storm,streetlights
pole Light in damaged storm,streetlights
pole damaged storm in Light,streetlights
storm Light in damaged pole,streetlights
in storm Light damaged pole,streetlights
in storm Light damaged pole,streetlights
damaged in storm Light pole,streetlights
storm in damaged Light pole,streetlights
in Light storm damaged pole,streetlights
damaged in Light storm pole,streetlights
damaged pole in storm Light,streetlights
damaged pole storm in Light,streetlights
damaged Light in pole storm,streetlights
damaged storm in pole Light,streetlights
storm in damaged pole Light,streetlights
Bulb fused for weeks,streetlights
for weeks fused Bulb,streetlights
fused for Bulb weeks,streetlights
Bulb fused for weeks,streetlights
Bulb weeks fused for,streetlights
weeks Bulb fused for,streetlights
weeks for Bulb fused,streetlights
Bulb fused for weeks,streetlights
for Bulb fused weeks,streetlights
fused weeks Bulb for,streetlights
for Bulb weeks fused,streetlights
for weeks Bulb fused,streetlights
fused Bulb weeks for,streetlights
fused for Bulb weeks,streetlights
Bulb weeks fused for,streetlights
fused weeks for Bulb,streetlights
Bulb for weeks fused,streetlights
fused for weeks Bulb,streetlights
No street light installed in new area,streetlights
area in street light installed No new,streetlights
No area street new light in installed,streetlights
area No installed in street new light,streetlights
in light area new installed street No,streetlights
new No installed in light street area,streetlights
light area street in installed No new,streetlights
street area new installed light No in,streetlights
light in new street installed area No,streetlights
in new installed area No street light,streetlights
new in area installed street No light,streetlights
street light in installed area No new,streetlights
area in street No installed new light,streetlights
No light in street installed new area,streetlights
No new street light in area installed,streetlights
new light No street installed area in,streetlights
street in installed No light new area,streetlights
light No area in street new installed,streetlights
Lights on during daytime waste,streetlights
daytime Lights on during waste,streetlights
daytime on waste during Lights,streetlights
waste on Lights daytime during,streetlights
waste daytime on during Lights,streetlights
waste Lights daytime on during,streetlights
waste on daytime during Lights,streetlights
waste on daytime Lights during,streetlights
waste on during Lights daytime,streetlights
daytime during Lights on waste,streetlights
on waste during Lights daytime,streetlights
on Lights waste daytime during,streetlights
Lights daytime during on waste,streetlights
during daytime waste Lights on,streetlights
on during waste Lights daytime,streetlights
waste on during daytime Lights,streetlights
during on daytime Lights waste,streetlights
daytime waste on during Lights,streetlights
daytime on during Lights waste,streetlights
during daytime Lights waste on,streetlights
Flickering street light at night,streetlights
at Flickering street night light,streetlights
Flickering street night at light,streetlights
light street night at Flickering,streetlights
Flickering street at night light,streetlights
at light street night Flickering,streetlights
at Flickering street night light,streetlights
at light Flickering street night,streetlights
light at street night Flickering,streetlights
light night Flickering street at,streetlights
night light at Flickering street,streetlights
street at Flickering night light,streetlights
at night light street Flickering,streetlights
night Flickering light at street,streetlights
night light street at Flickering,streetlights
at night Flickering street light,streetlights
night street at Flickering light,streetlights
Flickering at street night light,streetlights
LED light not replaced,streetlights
replaced light LED not,streetlights
replaced LED light not,streetlights
light LED replaced not,streetlights
light not replaced LED,streetlights
not LED light replaced,streetlights
light replaced LED not,streetlights
light not replaced LED,streetlights
not replaced LED light,streetlights
light not replaced LED,streetlights
not LED replaced light,streetlights
LED not replaced light,streetlights
replaced LED not light,streetlights
replaced light not LED,streetlights
not LED light replaced,streetlights
replaced LED light not,streetlights
replaced not light LED,streetlights
LED replaced light not,streetlights
LED not light replaced,streetlights
not replaced LED light,streetlights
Park is not maintained,parks
maintained is not Park,parks
is maintained Park not,parks
maintained is Park not,parks
maintained Park is not,parks
is Park not maintained,parks
maintained is Park not,parks
maintained is not Park,parks
maintained Park not is,parks
maintained not is Park,parks
maintained Park not is,parks
is not Park maintained,parks
Park is not maintained,parks
maintained Park is not,parks
Park maintained is not,parks
is Park maintained not,parks
maintained not Park is,parks
Park maintained is not,parks
is Park not maintained,parks
maintained Park not is,parks
Playground equipment is broken,parks
broken Playground equipment is,parks
broken Playground is equipment,parks
broken is equipment Playground,parks
Playground equipment is broken,parks
is Playground broken equipment,parks
is equipment Playground broken,parks
broken equipment is Playground,parks
is equipment broken Playground,parks
is broken equipment Playground,parks
equipment broken is Playground,parks
is Playground broken equipment,parks
Playground broken equipment is,parks
broken Playground is equipment,parks
Playground equipment broken is,parks
broken is Playground equipment,parks
is broken equipment Playground,parks
No security in park at night,parks
night at in park security No,parks
night in No security at park,parks
security No park night at in,parks
park night at security in No,parks
park No in security night at,parks
park night No at security in,parks
at No security park night in,parks
at in night No security park,parks
security at No night park in,parks
security in park at No night,parks
No park night at security in,parks
at night park security in No,parks
night park at in security No,parks
night security No park at in,parks
in park at night No security,parks
park No night in security at,parks
at night in No security park,parks
at night in security park No,parks
Trees are being cut illegally,parks
illegally Trees being are cut,parks
being Trees are illegally cut,parks
Trees illegally are being cut,parks
cut being are illegally Trees,parks
being illegally Trees cut are,parks
are being Trees cut illegally,parks
being cut are illegally Trees,parks
cut illegally are being Trees,parks
being cut are illegally Trees,parks
are illegally Trees being cut,parks
are cut Trees being illegally,parks
illegally cut being Trees are,parks
illegally Trees being cut are,parks
illegally being Trees are cut,parks
being illegally are Trees cut,parks
illegally being Trees cut are,parks
Trees are cut illegally being,parks
cut being are illegally Trees,parks
are cut illegally being Trees,parks
Garden fence is broken,parks
is broken fence Garden,parks
Garden is fence broken,parks
is fence broken Garden,parks
Garden fence is broken,parks
broken Garden is fence,parks
broken Garden is fence,parks
is broken Garden fence,parks
Garden is fence broken,parks
is Garden broken fence,parks
Garden is fence broken,parks
broken Garden is fence,parks
broken is fence Garden,parks
broken is fence Garden,parks
is Garden broken fence,parks
fence is Garden broken,parks
fence Garden broken is,parks
broken is fence Garden,parks
broken is fence Garden,parks
No proper seating in the park,parks
the in seating No proper park,parks
park No seating proper in the,parks
seating No in proper the park,parks
the seating in park proper No,parks
the No proper in seating park,parks
No proper park seating in the,parks
the park No in seating proper,parks
proper park No seating in the,parks
in the seating proper park No,parks
the park seating proper in No,parks
the No in park proper seating,parks
the No seating in proper park,parks
seating proper the park No in,parks
the proper seating park in No,parks
park No seating the proper in,parks
No park proper in the seating,parks
Park gate lock is broken,parks
Park is gate broken lock,parks
Park broken lock gate is,parks
lock broken gate Park is,parks
broken Park is gate lock,parks
Park broken lock is gate,parks
gate broken Park lock is,parks
gate lock is Park broken,parks
is lock gate broken Park,parks
gate broken is Park lock,parks
gate Park broken lock is,parks
broken lock is Park gate,parks
lock broken gate Park is,parks
Park lock gate broken is,parks
gate Park broken is lock,parks
gate Park lock broken is,parks
is lock gate Park broken,parks
is Park gate lock broken,parks
Bushes overgrown blocking path,parks
Bushes overgrown path blocking,parks
path Bushes overgrown blocking,parks
blocking Bushes overgrown path,parks
blocking Bushes overgrown path,parks
overgrown path blocking Bushes,parks
path blocking Bushes overgrown,parks
overgrown Bushes blocking path,parks
Bushes path blocking overgrown,parks
overgrown path blocking Bushes,parks
path Bushes overgrown blocking,parks
blocking path overgrown Bushes,parks
overgrown Bushes blocking path,parks
blocking Bushes path overgrown,parks
overgrown path Bushes blocking,parks
overgrown path blocking Bushes,parks
Bushes overgrown path blocking,parks
overgrown path blocking Bushes,parks
Bushes overgrown blocking path,parks
blocking path Bushes overgrown,parks
Construction noise at midnight,noise
at midnight Construction noise,noise
noise at Construction midnight,noise
noise at Construction midnight,noise
noise midnight Construction at,noise
at midnight noise Construction,noise
Construction midnight at noise,noise
Construction at midnight noise,noise
Construction noise midnight at,noise
midnight Construction noise at,noise
Construction at midnight noise,noise
noise at midnight Construction,noise
at noise Construction midnight,noise
noise at Construction midnight,noise
noise at midnight Construction,noise
at noise midnight Construction,noise
noise at midnight Construction,noise
noise Construction midnight at,noise
at midnight noise Construction,noise
Loud music from nearby party,noise
party Loud music nearby from,noise
nearby from Loud party music,noise
nearby from Loud party music,noise
Loud from nearby party music,noise
from party music nearby Loud,noise
from Loud music nearby party,noise
nearby from Loud music party,noise
Loud nearby party music from,noise
from party music Loud nearby,noise
party from Loud nearby music,noise
music Loud nearby party from,noise
music party nearby from Loud,noise
nearby Loud party from music,noise
nearby Loud from party music,noise
from party Loud music nearby,noise
Factory noise pollution daily,noise
daily Factory pollution noise,noise
Factory noise pollution daily,noise
daily Factory pollution noise,noise
noise daily Factory pollution,noise
pollution Factory daily noise,noise
Factory daily pollution noise,noise
pollution noise daily Factory,noise
daily noise pollution Factory,noise
pollution noise Factory daily,noise
daily noise Factory pollution,noise
pollution Factory noise daily,noise
pollution Factory noise daily,noise
daily noise Factory pollution,noise
pollution noise daily Factory,noise
daily pollution noise Factory,noise
Factory noise daily pollution,noise
Vehicle honking excessively,noise
Vehicle honking excessively,noise
honking Vehicle excessively,noise
excessively honking Vehicle,noise
honking excessively Vehicle,noise
Vehicle excessively honking,noise
Vehicle excessively honking,noise
excessively Vehicle honking,noise
honking excessively Vehicle,noise
excessively Vehicle honking,noise
honking Vehicle excessively,noise
Vehicle excessively honking,noise
Vehicle honking excessively,noise
honking Vehicle excessively,noise
excessively honking Vehicle,noise
honking Vehicle excessively,noise
Vehicle honking excessively,noise
Vehicle excessively honking,noise
Loudspeaker used after 10pm,noise
10pm used after Loudspeaker,noise
10pm Loudspeaker used after,noise
after used Loudspeaker 10pm,noise
after used Loudspeaker 10pm,noise
10pm Loudspeaker after used,noise
Loudspeaker after 10pm used,noise
used after Loudspeaker 10pm,noise
Loudspeaker 10pm used after,noise
10pm Loudspeaker after used,noise
10pm after Loudspeaker used,noise
10pm after Loudspeaker used,noise
after Loudspeaker used 10pm,noise
used 10pm after Loudspeaker,noise
used after 10pm Loudspeaker,noise
Loudspeaker used 10pm after,noise
10pm after Loudspeaker used,noise
Loudspeaker 10pm used after,noise
after used Loudspeaker 10pm,noise
used Loudspeaker 10pm after,noise
Loudspeaker used after 10pm,noise
Industrial noise affecting health,noise
Industrial noise affecting health,noise
health Industrial noise affecting,noise
affecting noise Industrial health,noise
health affecting noise Industrial,noise
health noise Industrial affecting,noise
affecting health noise Industrial,noise
health noise affecting Industrial,noise
health noise affecting Industrial,noise
noise affecting Industrial health,noise
Industrial noise affecting health,noise
Industrial health noise affecting,noise
health affecting Industrial noise,noise
health noise Industrial affecting,noise
health affecting noise Industrial,noise
noise health Industrial affecting,noise
noise Industrial health affecting,noise
health noise Industrial affecting,noise
DJ playing till late at night,noise
at DJ playing late night till,noise
till late DJ playing night at,noise
at till night playing late DJ,noise
DJ playing night late till at,noise
DJ at late night till playing,noise
DJ at till late night playing,noise
till at night playing DJ late,noise
night at DJ till late playing,noise
late night at DJ till playing,noise
night at till playing late DJ,noise
night DJ playing at late till,noise
at late playing DJ till night,noise
till night late DJ playing at,noise
till night playing DJ late at,noise
playing DJ late at till night,noise
playing DJ late till at night,noise
till late playing DJ at night,noise
till playing DJ at night late,noise
Generator noise is very loud,noise
Generator is noise loud very,noise
Generator noise loud is very,noise
noise very Generator loud is,noise
noise loud is very Generator,noise
loud very is noise Generator,noise
very loud is Generator noise,noise
loud noise is Generator very,noise
noise loud Generator is very,noise
very is noise loud Generator,noise
Generator noise is very loud,noise
Generator loud noise very is,noise
loud is Generator very noise,noise
Generator loud is very noise,noise
noise loud is very Generator,noise
Generator noise very loud is,noise
very loud Generator noise is,noise
noise very Generator loud is,noise
loud very Generator is noise,noise
Illegal encroachment on footpath,other
on footpath encroachment Illegal,other
footpath on Illegal encroachment,other
Illegal on footpath encroachment,other
footpath Illegal on encroachment,other
encroachment Illegal footpath on,other
Illegal footpath on encroachment,other
Illegal encroachment footpath on,other
Illegal on footpath encroachment,other
footpath on Illegal encroachment,other
footpath encroachment on Illegal,other
encroachment Illegal footpath on,other
encroachment Illegal footpath on,other
on encroachment Illegal footpath,other
encroachment Illegal footpath on,other
footpath on Illegal encroachment,other
encroachment on footpath Illegal,other
Stray dog menace in area,other
dog area Stray menace in,other
dog menace Stray area in,other
in Stray menace dog area,other
dog menace area in Stray,other
Stray menace area dog in,other
Stray dog area in menace,other
dog menace area in Stray,other
dog menace in Stray area,other
Stray in dog menace area,other
area Stray dog in menace,other
area in Stray dog menace,other
menace area dog Stray in,other
Stray area in dog menace,other
in dog Stray menace area,other
area Stray in menace dog,other
area Stray in menace dog,other
area Stray in dog menace,other
dog Stray in area menace,other
Unauthorized parking on road,other
on road Unauthorized parking,other
parking road Unauthorized on,other
Unauthorized on road parking,other
road on parking Unauthorized,other
Unauthorized parking on road,other
parking Unauthorized on road,other
road on parking Unauthorized,other
road parking on Unauthorized,other
Unauthorized parking road on,other
road parking on Unauthorized,other
parking Unauthorized on road,other
Unauthorized road on parking,other
parking on road Unauthorized,other
road Unauthorized parking on,other
parking Unauthorized road on,other
Hoarding blocking view,other
Hoarding view blocking,other
Hoarding blocking view,other
view blocking Hoarding,other
view Hoarding blocking,other
view Hoarding blocking,other
blocking view Hoarding,other
Hoarding view blocking,other
blocking Hoarding view,other
Hoarding view blocking,other
blocking view Hoarding,other
view Hoarding blocking,other
view Hoarding blocking,other
view Hoarding blocking,other
view Hoarding blocking,other
Hoarding blocking view,other
blocking view Hoarding,other
view Hoarding blocking,other
Hoarding view blocking,other
Hoarding blocking view,other
Building construction without permission,other
construction without Building permission,other
permission construction without Building,other
without Building permission construction,other
permission construction Building without,other
without permission construction Building,other
construction permission without Building,other
permission without construction Building,other
construction permission without Building,other
Building without construction permission,other
permission Building construction without,other
without permission Building construction,other
without permission construction Building,other
Building without permission construction,other
permission without Building construction,other
without construction Building permission,other
Building permission construction without,other
construction Building without permission,other
Shop encroaching on road,other
Shop on encroaching road,other
encroaching road Shop on,other
encroaching Shop on road,other
on Shop road encroaching,other
encroaching Shop road on,other
encroaching road on Shop,other
encroaching on Shop road,other
Shop encroaching road on,other
on encroaching Shop road,other
road on Shop encroaching,other
on Shop road encroaching,other
Shop encroaching road on,other
encroaching road on Shop,other
Shop on encroaching road,other
encroaching on Shop road,other
on encroaching Shop road,other
Shop on encroaching road,other
encroaching Shop road on,other
encroaching Shop on road,other
Begging organized near temple,other
Begging near organized temple,other
Begging temple near organized,other
temple organized near Begging,other
Begging organized temple near,other
temple organized near Begging,other
Begging temple near organized,other
Begging near organized temple,other
Begging near organized temple,other
near Begging organized temple,other
temple Begging near organized,other
Begging near organized temple,other
temple organized near Begging,other
Begging near temple organized,other
temple organized Begging near,other
near temple Begging organized,other
near Begging temple organized,other
near organized Begging temple,other
temple organized Begging near,other
near organized temple Begging,other
near Begging temple organized,other
Illegal advertisement boards,other
Illegal boards advertisement,other
boards Illegal advertisement,other
Illegal advertisement boards,other
Illegal boards advertisement,other
advertisement Illegal boards,other
advertisement Illegal boards,other
Illegal boards advertisement,other
Illegal advertisement boards,other
boards Illegal advertisement,other
boards Illegal advertisement,other
advertisement Illegal boards,other
Illegal boards advertisement,other
Illegal boards advertisement,other
Illegal advertisement boards,other
advertisement Illegal boards,other
advertisement boards Illegal,other
advertisement Illegal boards,other
Illegal boards advertisement,other
advertisement boards Illegal,other
